{
  "schema_version": "1.0.0",
  "trace_id": "trace-a08-b08-demo-001",
  "pair_id": "A08-B08",
  "idempotency_key": "b08-draft-001",
  "job_type": "DRAFT",
  "input": {
    "subject": {
      "repository_url": "https://github.com/example/b08-demo.git",
      "commit": "0123456789abcdef0123456789abcdef01234567",
      "configuration_id": "ubuntu-22.04-gcc-11-release"
    },
    "context_documents": [
      "README.md",
      "INSTALL.md"
    ],
    "build": {
      "working_directory": "/workspace",
      "build_command": "make -j2",
      "verify_command": "./bin/demo --version",
      "max_iterations": 8,
      "timeout_seconds": 900,
      "base_image_hint": "ubuntu:22.04"
    }
  }
}
